product_url,product_name,brand_name,rating,number_of_ratings,product_description,release_date,top_notes,middle_notes,base_notes,main_accords,perfumer,product_images,gender,longevity,sillage,scraped_at,source,notes
https://www.fragrantica.com/perfume/Byredo/Mister-Marvelous-Eau-de-Cologne-25294.html,Mister Marvelous Eau de Cologne Byredofor men,Byredo,3.87,23.0,"Mister Marvelous Eau de ColognebyByredois a Woody Aromatic fragrance for men.Mister Marvelous Eau de Colognewas launched in 2014. Top notes are Neroli and Petitgrain; middle notes are Bamboo and Lavender; base notes are Cedar and Amber.Byredo is launching three fragrances of the modern new collection of eaux de cologne named after popular editions of the house: Gypsy Water, Sunday Cologne and Mister Marvelous, available as eau de cologne and certainly in flacons larger than the usual EDT and EDP editions. The new Cologne collection is an extension of the existing line towards a contemporary presentation of eau de cologne, created of top quality raw materials, as charismatic, exciting and elegant.All three fragrances which are now available in the eau de cologne collection retain their original olfactive identity by obtaining a fresher and dashier character. The new eaux de cologne Byredo will be available on the market starting from May 2014.MISTER MARVELOUS EAU DE COLOGNE
includes petitgrain, neroli in the top, lavender, bamboo in the heart and cedar and amber in the base.",2014.0,"Neroli, Petitgrain","Bamboo, Lavender","Cedar, Amber","woody, citrus, aromatic, white floral",,https://fimgs.net/mdimg/perfume-thumbs/375x500.25294.jpg,for men,,,2026-06-06 23:48:32,Fragrantica,
https://www.fragrantica.com/perfume/Byredo/Sunday-Cologne-Eau-de-Cologne-25295.html,Sunday Cologne Eau de Cologne Byredofor women and men,Byredo,3.56,36.0,"Sunday Cologne Eau de ColognebyByredois a Woody Aromatic fragrance for women and men.Sunday Cologne Eau de Colognewas launched in 2014. Top notes are Bergamot, Star Anise and Cardamom; middle notes are Lavender, Geranium and Incense; base notes are Vetiver, Moss and Patchouli.Byredo is launching three fragrances of the modern new collection of eaux de cologne named after popular editions of the house: Gypsy Water, Sunday Cologne and Mister Marvelous, available as eau de cologne and certainly in flacons larger than the usual EDT and EDP editions. The new Cologne collection is an extension of the existing line towards a contemporary presentation of eau de cologne, created of top quality raw materials, as charismatic, exciting and elegant.All three fragrances which are now available in the eau de cologne collection retain their original olfactive identity by obtaining a fresher and dashier character. The new eaux de cologne Byredo will be available on the market starting from May 2014.SUNDAY COLOGNE EAU DE COLOGNE
includes star annise, cardamom, bergamot in the top,lavender, geranium, incense in the heart and vetiver, patchouli and moss in the base.",2014.0,"Bergamot, Star Anise, Cardamom","Lavender, Geranium, Incense","Vetiver, Moss, Patchouli","aromatic, fresh spicy, citrus, woody",,https://fimgs.net/mdimg/perfume-thumbs/375x500.25295.jpg,for women and men,,,2026-06-06 23:48:40,Fragrantica,
https://www.fragrantica.com/perfume/Byredo/Bal-d-Afrique-Hair-Perfume-71942.html,Bal d'Afrique Hair Perfume Byredofor women and men,Byredo,4.2,45.0,"Bal d'Afrique Hair PerfumebyByredois a Floral Woody Musk fragrance for women and men.Bal d'Afrique Hair Perfumewas launched in 2015. Top notes are Bergamot, Lemon, Marigold and Neroli; middle notes are Buchu or Agathosma, Violet, Jasmine and Cyclamen; base notes are Vetiver, Black Amber, Musk and Moroccan Cedar.",2015.0,"Bergamot, Lemon, Marigold, Neroli","Buchu or Agathosma, Violet, Jasmine, Cyclamen","Vetiver, Black Amber, Musk, Moroccan Cedar","aromatic, citrus, woody, earthy",,https://fimgs.net/mdimg/perfume-thumbs/375x500.71942.jpg,for women and men,,,2026-06-06 23:48:51,Fragrantica,
https://www.fragrantica.com/perfume/Byredo/Byredo-Blanche-Hair-Perfume-46222.html,Byredo Blanche Hair Perfume Byredofor women,Byredo,4.07,55.0,"Byredo Blanche Hair PerfumebyByredois a Floral Aldehyde fragrance for women. Top notes are Aldehydes, Pink Pepper and White Rose; middle notes are Violet, Peony and Neroli; base notes are Musk, Cashmeran and Sandalwood.",,"Aldehydes, Pink Pepper, White Rose","Violet, Peony, Neroli","Musk, Cashmeran, Sandalwood","powdery, musky, fresh, aldehydic",,https://fimgs.net/mdimg/perfume-thumbs/375x500.46222.jpg,for women,,,2026-06-06 23:49:02,Fragrantica,
https://www.fragrantica.com/perfume/Byredo/Gypsy-Water-Hair-Perfume-71940.html,Gypsy Water Hair Perfume Byredofor women and men,Byredo,4.24,38.0,"Gypsy Water Hair PerfumebyByredois a Woody Aromatic fragrance for women and men.Gypsy Water Hair Perfumewas launched in 2015. Top notes are Pepper, Juniper Berries, Lemon and Bergamot; middle notes are Incense, Pine needles and Orris; base notes are Amber, Vanilla and Sandalwood.",2015.0,"Pepper, Juniper Berries, Lemon, Bergamot","Incense, Pine needles, Orris","Amber, Vanilla, Sandalwood","amber, woody, aromatic, vanilla",,https://fimgs.net/mdimg/perfume-thumbs/375x500.71940.jpg,for women and men,,,2026-06-06 23:49:14,Fragrantica,
https://www.fragrantica.com/perfume/Byredo/La-Tulipe-Hair-Perfume-71939.html,La Tulipe Hair Perfume Byredofor women and men,Byredo,4.0,34.0,La Tulipe Hair PerfumebyByredois a Floral fragrance for women and men.La Tulipe Hair Perfumewas launched in 2016. Top notes are Cyclamen and Rhubarb; middle notes are Tulip and Freesia; base notes are White Woods and Vetiver.,2016.0,"Cyclamen, Rhubarb","Tulip, Freesia","White Woods, Vetiver","floral, green, soft spicy, woody",,https://fimgs.net/mdimg/perfume-thumbs/375x500.71939.jpg,for women and men,,,2026-06-06 23:49:20,Fragrantica,
https://www.fragrantica.com/perfume/Byredo/Mojave-Ghost-Hair-Perfume-71938.html,Mojave Ghost Hair Perfume Byredofor women and men,Byredo,4.09,47.0,"Mojave Ghost Hair PerfumebyByredois a Oriental Floral fragrance for women and men.Mojave Ghost Hair Perfumewas launched in 2016. Top notes are Ambrette (Musk Mallow) and Sapodilla; middle notes are Violet, Magnolia and Sandalwood; base notes are Cedar and Ambergris.",2016.0,"Ambrette (Musk Mallow), Sapodilla","Violet, Magnolia, Sandalwood","Cedar, Ambergris","floral, musky, woody, powdery",,https://fimgs.net/mdimg/perfume-thumbs/375x500.71938.jpg,for women and men,,,2026-06-06 23:49:30,Fragrantica,
https://www.fragrantica.com/perfume/Byredo/Rose-Of-No-Man-s-Land-Hair-Perfume-71937.html,Rose Of No Man's Land Hair Perfume Byredofor women and men,Byredo,3.68,22.0,Rose Of No Man's Land Hair PerfumebyByredois a Oriental Floral fragrance for women and men. Top notes are Turkish Rose and Pink Pepper; middle notes are Turkish Rose and Raspberry Bloom; base notes are Papyrus and White Amber.,,"Turkish Rose, Pink Pepper","Turkish Rose, Raspberry Bloom","Papyrus, White Amber","rose, floral, woody, soft spicy",,https://fimgs.net/mdimg/perfume-thumbs/375x500.71937.jpg,for women and men,,,2026-06-06 23:49:39,Fragrantica,
https://www.fragrantica.com/perfume/Byredo/Bois-Obscur-115292.html,Bois Obscur Byredofor women and men,Byredo,3.4,110.0,"Bois ObscurbyByredois a Oriental Woody fragrance for women and men. This is a new fragrance.Bois Obscurwas launched in 2025. The nose behind this fragrance is Jérôme Epinette. Top notes are Saffron, Eucalyptus and Papyrus; middle notes are Oud, Tuberose and Jasmine; base notes are Patchouli, Labdanum, Sandalwood and Amber.Bois Obscur is part of Byredo’s Night Veils collection and is presented as an extrait with a woody-amber floral profile. It opens with saffron, eucalyptus, and smoky papyrus, moves into a heart of jasmine absolute, oud, and tuberose absolute, and rests on labdanum, patchouli, sandalwood, and a mineral amber note. The fragrance is packaged in an elongated bottle with a thick glass base and an antique gold cap, housed in a reusable box.",2025.0,"Saffron, Eucalyptus, Papyrus","Oud, Tuberose, Jasmine","Patchouli, Labdanum, Sandalwood, Amber","woody, oud, warm spicy, white floral",Jérôme Epinette,https://fimgs.net/mdimg/perfume-thumbs/375x500.115292.jpg,for women and men,,,2026-06-06 23:49:47,Fragrantica,
https://www.fragrantica.com/perfume/Byredo/Casablanca-Lily-32777.html,Casablanca Lily Byredofor women and men,Byredo,3.84,49.0,Casablanca LilybyByredois a Oriental Floral fragrance for women and men.Casablanca Lilywas launched in 2015. Top notes are Gardenia and Plum; middle notes are Indian Tuberose and Cloves; base notes are Palisander Rosewood and Honey.,2015.0,"Gardenia, Plum","Indian Tuberose, Cloves","Palisander Rosewood, Honey","white floral, sweet, tuberose, fruity",,https://fimgs.net/mdimg/perfume-thumbs/375x500.32777.jpg,for women and men,,,2026-06-06 23:49:56,Fragrantica,
https://www.fragrantica.com/perfume/Byredo/Casablanca-Lily-2019-58570.html,Casablanca Lily 2019 Byredofor women and men,Byredo,4.2,1132.0,Casablanca Lily 2019byByredois a Oriental Floral fragrance for women and men.Casablanca Lily 2019was launched in 2019. Top notes are Gardenia and Plum; middle notes are Indian Tuberose and Carnation; base notes are Honey and Palisander Rosewood.,2019.0,"Gardenia, Plum","Indian Tuberose, Carnation","Honey, Palisander Rosewood","white floral, honey, sweet, tuberose",,https://fimgs.net/mdimg/perfume-thumbs/375x500.58570.jpg,for women and men,,,2026-06-06 23:50:05,Fragrantica,
https://www.fragrantica.com/perfume/Byredo/Casablanca-Lily-2025-115293.html,Casablanca Lily 2025 Byredofor women and men,Byredo,4.18,89.0,"Casablanca Lily 2025byByredois a Floral fragrance for women and men. This is a new fragrance.Casablanca Lily 2025was launched in 2025. Top notes are Gardenia and Plum; middle notes are Indian Tuberose and Carnation; base notes are Honey and Palisander Rosewood.Casablanca Lily by Byredo is an extrait de parfum in the Night Veils collection. The composition opens with gardenia and plum, moves through a heart of carnation and Indian tuberose, and settles on rosewood and a soft honey accord, presenting a floral profile with subtle fruity and warm woody facets.",2025.0,"Gardenia, Plum","Indian Tuberose, Carnation","Honey, Palisander Rosewood","white floral, tuberose, floral, sweet",,https://fimgs.net/mdimg/perfume-thumbs/375x500.115293.jpg,for women and men,,,2026-06-06 23:50:14,Fragrantica,
https://www.fragrantica.com/perfume/Byredo/Cuir-Sellier-2025-115296.html,Cuir Sellier 2025 Byredofor women and men,Byredo,3.7,57.0,Cuir Sellier 2025byByredois a Leather fragrance for women and men. This is a new fragrance.Cuir Sellier 2025was launched in 2025. Top note is Cashmeran; middle notes are Leather and Tobacco; base notes are Birch and Oakmoss.,2025.0,Cashmeran,"Leather, Tobacco","Birch, Oakmoss","leather, smoky, woody, mossy",,https://fimgs.net/mdimg/perfume-thumbs/375x500.115296.jpg,for women and men,,,2026-06-06 23:50:22,Fragrantica,
https://www.fragrantica.com/perfume/Byredo/La-Botte-41720.html,La Botte Byredofor women and men,Byredo,4.17,59.0,"La BottebyByredois a Leather fragrance for women and men.La Bottewas launched in 2016. Top note is Jasmine; middle notes are Violet and Synthetic Civet; base notes are Leather and Mahogany.""Riding on the success of the first Night Veils collection dedicated to heady flowers that bloom come nightfall, a new variation of elixirs is about to dawn. Housed in 30 ml onyx glass bottles, the three new compositions draw inspiration from the craft of leatherworking. So precious are these extracts, a mere drop deposited at the nape of the neck with the glass stopper is enough to diffuse their scent for hours on end. This new trio of night veils pays tribute to the delicate hand of the glovemaker, the fine skill of the bootmaker and the genius of the saddler. La Botte -
the ultimate expression of luxury, the bootmaker continues the fine tradition of custom-made footwear to this day. The workshop evokes the smell of new boots still nestled in their box, freshly buffed leather, the patinated wood shoe trees arranged by size on the shelves and the sound of heels click-clacking down the sidewalk."" - a note from the brand.La Botte by Byredo is a Leather fragrance for women and men. This is a new fragrance. La Botte was launched in 2016. Top note is jasmine; middle notes are violet and synthetic civet; base notes are mahogany and leather.",2016.0,Jasmine,"Violet, Synthetic Civet","Leather, Mahogany","leather, violet, animalic, powdery",,https://fimgs.net/mdimg/perfume-thumbs/375x500.41720.jpg,for women and men,,,2026-06-06 23:50:30,Fragrantica,
https://www.fragrantica.com/perfume/Byredo/La-Selle-41721.html,La Selle Byredofor women and men,Byredo,4.0,41.0,"La SellebyByredois a Leather fragrance for women and men.La Sellewas launched in 2016. Top notes are Cashmeran and Black Tea; middle notes are Leather and Tobacco Leaf; base notes are Birch and Oakmoss.""Following the first Night Veils collection dedicated to heady flowers that bloom come nightfall, a new variation of elixirs is about to dawn. A singular exercise that consists of writing three formulas with a high concentration of noble raw materials, based on a theme chosen by Ben Gorham. Housed in 30 ml onyx glass bottles, the three new compositions draw inspiration from the craft of leatherworking. So precious are these extracts, a mere drop deposited at the nape of the neck with the glass stopper is enough to diffuse their scent for hours on end. This new trio of night veils pays tribute to the delicate hand of the glovemaker, the fine skill of the bootmaker and the genius of the saddler. La Selle - an essential ally of any equestrian, the passionate saddler brings horse and rider together as one. Of the three Night Veils fragrances dedicated to leather, this is undoubtedly the most dynamic. Distinguished, sombre, smoky, a truly unbridled concentration of leather."" - a note from the brand.La Selle by Byredo is a Leather fragrance for women and men. This is a new fragrance. La Selle was launched in 2016. Top notes are black tea and cashmeran; middle notes are leather and tobacco leaf; base notes are birch and oakmoss.",2016.0,"Cashmeran, Black Tea","Leather, Tobacco Leaf","Birch, Oakmoss","leather, woody, smoky, mossy",,https://fimgs.net/mdimg/perfume-thumbs/375x500.41721.jpg,for women and men,,,2026-06-06 23:50:40,Fragrantica,
https://www.fragrantica.com/perfume/Byredo/Le-Gant-41722.html,Le Gant Byredofor women and men,Byredo,4.21,47.0,"Le GantbyByredois a Leather fragrance for women and men.Le Gantwas launched in 2016. Top notes are Bergamot and Saffron; middle notes are Heliotrope and Mimosa; base notes are Leather, Acai Berry, Musk and Amber.""Riding on the success of the first Night Veils collection dedicated to heady flowers that bloom come nightfall, a new variation of elixirs is about to dawn. Housed in 30 ml onyx glass bottles, the three new compositions draw inspiration from the craft of leatherworking. So precious are these extracts, a mere drop deposited at the nape of the neck with the glass stopper is enough to diffuse their scent for hours on end. This new trio of night veils pays tribute to the delicate hand of the glovemaker, the fine skill of the bootmaker and the genius of the saddler. Le Gant - with historical ties to fragrance, the glovemaker’s trade was so deeply intertwined with olfaction. Animal skin requires essences to dissipate its exceedingly wild vapors. Still today, those who work with hides and pelts share a vocabulary with the perfumer. Inspired by the delicate leather that hugs the skin, Gantier has the suppleness and refinement of a rare hide."" - a note from the brand.Le Gant by Byredo is a Leather fragrance for women and men. This is a new fragrance. Le Gant was launched in 2016. Top notes are bergamot and saffron; middle notes are heliotrope and mimosa; base notes are acai berry, musk, leather and amber.",2016.0,"Bergamot, Saffron","Heliotrope, Mimosa","Leather, Acai Berry, Musk, Amber","powdery, leather, musky, fruity",,https://fimgs.net/mdimg/perfume-thumbs/375x500.41722.jpg,for women and men,,,2026-06-06 23:50:49,Fragrantica,
https://www.fragrantica.com/perfume/Byredo/Midnight-Candy-32778.html,Midnight Candy Byredofor women and men,Byredo,4.08,59.0,Midnight CandybyByredois a Floral fragrance for women and men.Midnight Candywas launched in 2015. Top notes are Iris Flower and Carrot; middle notes are Black Violet and Egyptian Jasmine; base notes are Vanilla and Osmanthus.,2015.0,"Iris Flower, Carrot","Black Violet, Egyptian Jasmine","Vanilla, Osmanthus","powdery, violet, iris, floral",,https://fimgs.net/mdimg/perfume-thumbs/375x500.32778.jpg,for women and men,,,2026-06-06 23:50:55,Fragrantica,
https://www.fragrantica.com/perfume/Byredo/Reine-de-Nuit-32779.html,Reine de Nuit Byredofor women and men,Byredo,4.26,82.0,"Reine de NuitbyByredois a Chypre Floral fragrance for women and men.Reine de Nuitwas launched in 2015. Top notes are Black Currant and Saffron; middle notes are Incense and Alumroot; base notes are Black Rose, Patchouli and Ambrette (Musk Mallow).",2015.0,"Black Currant, Saffron","Incense, Alumroot","Black Rose, Patchouli, Ambrette (Musk Mallow)","rose, warm spicy, floral, amber",,https://fimgs.net/mdimg/perfume-thumbs/375x500.32779.jpg,for women and men,,,2026-06-06 23:51:05,Fragrantica,
https://www.fragrantica.com/perfume/Byredo/Reine-de-Nuit-2019-58569.html,Reine de Nuit 2019 Byredofor women and men,Byredo,4.18,834.0,Reine de Nuit 2019byByredois a Chypre Floral fragrance for women and men.Reine de Nuit 2019was launched in 2019. Top notes are Black Currant and Saffron; middle notes are Rose and Incense; base notes are Patchouli and Ambrette (Musk Mallow).,2019.0,"Black Currant, Saffron","Rose, Incense","Patchouli, Ambrette (Musk Mallow)","warm spicy, rose, fruity, woody",,https://fimgs.net/mdimg/perfume-thumbs/375x500.58569.jpg,for women and men,,,2026-06-06 23:51:11,Fragrantica,
https://www.fragrantica.com/perfume/Byredo/Rouge-Chaotique-83369.html,Rouge Chaotique Byredofor women and men,Byredo,4.02,810.0,"Rouge ChaotiquebyByredois a Woody Spicy fragrance for women and men.Rouge Chaotiquewas launched in 2023. Top notes are Saffron, Cassis, Bergamot and Lemon; middle notes are Plum, Praline and Oak; base notes are Agarwood (Oud), Papyrus and Patchouli.The first oud gourmand fragrance in our Night Veils collection, Rouge Chaotique takes personal inspiration from Ben Gorham’s belief that accepting the chaos within any creative process can result in singular forms of expression.",2023.0,"Saffron, Cassis, Bergamot, Lemon","Plum, Praline, Oak","Agarwood (Oud), Papyrus, Patchouli","fruity, woody, sweet, warm spicy",,https://fimgs.net/mdimg/perfume-thumbs/375x500.83369.jpg,for women and men,,,2026-06-06 23:51:22,Fragrantica,
https://www.fragrantica.com/perfume/Byredo/Rouge-Chaotique-2025-115295.html,Rouge Chaotique 2025 Byredofor women and men,Byredo,3.44,71.0,"Rouge Chaotique 2025byByredois a Oriental Woody fragrance for women and men. This is a new fragrance.Rouge Chaotique 2025was launched in 2025. Top note is Cassis; middle note is Oak; base notes are Papyrus, Oud and Patchouli.",2025.0,Cassis,Oak,"Papyrus, Oud, Patchouli","woody, aromatic, green, fruity",,https://fimgs.net/mdimg/perfume-thumbs/375x500.115295.jpg,for women and men,,,2026-06-06 23:51:32,Fragrantica,
https://www.fragrantica.com/perfume/Byredo/Sellier-58572.html,Sellier Byredofor women and men,Byredo,4.11,808.0,SellierbyByredois a Leather fragrance for women and men.Sellierwas launched in 2019. Top notes are Cashmeran and Black Tea; middle notes are Leather and Tobacco Leaf; base notes are Birch and Oakmoss.,2019.0,"Cashmeran, Black Tea","Leather, Tobacco Leaf","Birch, Oakmoss","leather, woody, smoky, tobacco",,https://fimgs.net/mdimg/perfume-thumbs/375x500.58572.jpg,for women and men,,,2026-06-06 23:51:41,Fragrantica,
https://www.fragrantica.com/perfume/Byredo/Tobacco-Mandarin-63031.html,Tobacco Mandarin Byredofor women and men,Byredo,3.81,1287.0,"Tobacco MandarinbyByredois a Oriental Woody fragrance for women and men.Tobacco Mandarinwas launched in 2020. Top notes are Cumin, Mandarin Orange and Coriander; middle notes are Tobacco, Leather and Labdanum; base notes are Olibanum, Agarwood (Oud) and Sandalwood.",2020.0,"Cumin, Mandarin Orange, Coriander","Tobacco, Leather, Labdanum","Olibanum, Agarwood (Oud), Sandalwood","fresh spicy, tobacco, amber, citrus",,https://fimgs.net/mdimg/perfume-thumbs/375x500.63031.jpg,for women and men,,,2026-06-06 23:51:50,Fragrantica,
https://www.fragrantica.com/perfume/Byredo/Vanille-Antique-73438.html,Vanille Antique Byredofor women and men,Byredo,4.04,1572.0,Vanille AntiquebyByredois a Oriental Woody fragrance for women and men.Vanille Antiquewas launched in 2022. Top notes are Musk and Plum; middle notes are White Wood and Labdanum; base notes are Vanilla and Amber.,2022.0,"Musk, Plum","White Wood, Labdanum","Vanilla, Amber","amber, vanilla, woody, musky",,https://fimgs.net/mdimg/perfume-thumbs/375x500.73438.jpg,for women and men,,,2026-06-06 23:51:59,Fragrantica,
https://www.fragrantica.com/perfume/Byredo/Vanille-Antique-2025-115294.html,Vanille Antique 2025 Byredofor women and men,Byredo,4.03,174.0,"Vanille Antique 2025byByredois a Oriental Vanilla fragrance for women and men. This is a new fragrance.Vanille Antique 2025was launched in 2025. Top notes are Plum and Freesia; middle notes are Amber, Oud, Cashmere Wood and Tuberose; base notes are Madagascar Vanilla and Labdanum.Vanille Antique is part of Byredo’s Night Veils collection of extrait-strength fragrances, built around a nuanced interpretation of vanilla within an amber-woody frame. It opens with freesia and plum, moves through a heart of amber, cashmere woods, oud, and tuberose absolute, and settles on a resinous base of Madagascar vanilla and cistus oil. The composition presents vanilla in a darker, more textured context, balancing floral facets with balsamic warmth.",2025.0,"Plum, Freesia","Amber, Oud, Cashmere Wood, Tuberose","Madagascar Vanilla, Labdanum","amber, vanilla, woody, oud",,https://fimgs.net/mdimg/perfume-thumbs/375x500.115294.jpg,for women and men,,,2026-06-06 23:52:08,Fragrantica,
https://www.fragrantica.com/perfume/Byredo/Oliver-Peoples-Champagne-38820.html,Oliver Peoples Champagne Byredofor women and men,Byredo,4.06,32.0,"Oliver Peoples ChampagnebyByredois a Woody Aromatic fragrance for women and men.Oliver Peoples Champagnewas launched in 2015. Top notes are Juniper Berries and Californian Lemon; middle notes are Patchouli and Orris; base notes are Immortelle, Sand and Musk.",2015.0,"Juniper Berries, Californian Lemon","Patchouli, Orris","Immortelle, Sand, Musk","woody, patchouli, aromatic, warm spicy",,https://fimgs.net/mdimg/perfume-thumbs/375x500.38820.jpg,for women and men,,,2026-06-06 23:52:15,Fragrantica,
https://www.fragrantica.com/perfume/Byredo/Oliver-Peoples-Green-38821.html,Oliver Peoples Green Byredofor women and men,Byredo,3.91,44.0,"Oliver Peoples GreenbyByredois a Woody Aromatic fragrance for women and men.Oliver Peoples Greenwas launched in 2015. Top notes are Juniper Berries and Californian Lemon; middle notes are Patchouli and Orris; base notes are Sand, Immortelle and Musk.",2015.0,"Juniper Berries, Californian Lemon","Patchouli, Orris","Sand, Immortelle, Musk","aromatic, woody, warm spicy, sand",,https://fimgs.net/mdimg/perfume-thumbs/375x500.38821.jpg,for women and men,,,2026-06-06 23:52:23,Fragrantica,
