product_url,product_name,brand_name,rating,number_of_ratings,product_description,release_date,top_notes,middle_notes,base_notes,main_accords,perfumer,product_images,gender,longevity,sillage,scraped_at,source,notes
https://www.fragrantica.com/perfume/Byredo/Oliver-Peoples-Indigo-30946.html,Oliver Peoples Indigo Byredofor women and men,Byredo,4.01,161.0,"Oliver Peoples IndigobyByredois a Woody Aromatic fragrance for women and men.Oliver Peoples Indigowas launched in 2015. Top notes are Juniper Berries and Californian Lemon; middle notes are Patchouli and Iris; base notes are Sand, Musk and Immortelle.Oliver Peoples & Byredo launch limited summer collection which includes perfume and sunglasses created in style and colors to fit each other. The collection was inspired by the phenomenon of synthesis joining thought, styles and views of the direction of both brands.""Ben and I share similar views on the positioning of brand and esthetics. We share similar views of positioning of the brand and esthetics. We have always wanted to work on a project together."" -says David Schulte, Oliver Peoples CEO. ""A year ago he invited me and said the word ‘synthesis’ which I never heard before. I liked it and we developed concept by joining LA influence of vision and fashion. Oliver Peoples has never created anything else but glasses, so venturing into fragrance was a big deal for us. I cannot imagine anyone better than Byredo to do that with.""The concept of the new limited collection is extremely interesting, since master perfumer of the house of Byredo got the task to observe the sights of Los Angeles through different colors of lenses, to visualize the scent and to interpret it into a layered composition.The unique idea resulted in created glasses in color paired with sunglasses frame in the same shades, color of perfume flacon and skilfully nuanced composition of the fragrance. The whole concept is very modern and aimed at men and women. Sunglasses frame and fragrances are unisex. Face of the advertising campaign Oliver Peoples & Byredo is model Frida Gustavsson (on the photo).According to Oliver Peoples, the frames are available in two colors (Semi Matte Black and Beige Crystal) while glass for the unisex sunglasses can be chosen in three shades (Indigo, Champagne and Green). Fragrances and sunglasses will be available separately and in special sets, together and paired per colors. Flacons of the new fragrance go with colors of glass and are created in the same shades: indigo, champagne and green.""I have admired Oliver Peoples since I felt their approach to a product similar to ours in Byredo brand. It was very important to me that this partnership has the right reason for existence and synthesis, and the idea of a joint perception was ideal for a joint venture. I met artists, musicians and perfumers who present characteristics of the so-called disorder and I was always fascinated by clarity of their descriptions"" - stated Ben Gorham, creative director and owner of Byredo.Fragrance Oliver Peoples Byredo arrives in concentration Eau de Parfum 50ml as limited edition. The composition opens with aromatic juniper berries combined with Californian lemon. The heart highlights iris and patchouli, while the base provides depth and warmth to aromas of sand, musk and immortelle.",2015.0,"Juniper Berries, Californian Lemon","Patchouli, Iris","Sand, Musk, Immortelle","aromatic, woody, patchouli, fresh spicy",,https://fimgs.net/mdimg/perfume-thumbs/375x500.30946.jpg,for women and men,,,2026-06-06 23:52:30,Fragrantica,
https://www.fragrantica.com/perfume/Byredo/Oliver-Peoples-Moss-38818.html,Oliver Peoples Moss Byredofor women and men,Byredo,3.95,42.0,"Oliver Peoples MossbyByredois a Woody Aromatic fragrance for women and men.Oliver Peoples Mosswas launched in 2016. Top notes are Juniper Berries and Californian Lemon; middle notes are Patchouli and Orris; base notes are Immortelle, Musk and Sand.",2016.0,"Juniper Berries, Californian Lemon","Patchouli, Orris","Immortelle, Musk, Sand","aromatic, woody, warm spicy, herbal",,https://fimgs.net/mdimg/perfume-thumbs/375x500.38818.jpg,for women and men,,,2026-06-06 23:52:42,Fragrantica,
https://www.fragrantica.com/perfume/Byredo/Oliver-Peoples-Mustard-38816.html,Oliver Peoples Mustard Byredofor women and men,Byredo,3.88,33.0,"Oliver Peoples MustardbyByredois a Woody Aromatic fragrance for women and men.Oliver Peoples Mustardwas launched in 2016. Top notes are Juniper Berries and Californian Lemon; middle notes are Patchouli and Orris; base notes are Sand, Immortelle and Musk.",2016.0,"Juniper Berries, Californian Lemon","Patchouli, Orris","Sand, Immortelle, Musk","aromatic, sand, woody, fresh spicy",,https://fimgs.net/mdimg/perfume-thumbs/375x500.38816.jpg,for women and men,,,2026-06-06 23:52:52,Fragrantica,
https://www.fragrantica.com/perfume/Byredo/Oliver-Peoples-Rosewood-38819.html,Oliver Peoples Rosewood Byredofor women and men,Byredo,3.93,44.0,"Oliver Peoples RosewoodbyByredois a Woody Aromatic fragrance for women and men.Oliver Peoples Rosewoodwas launched in 2016. Top notes are Juniper Berries and Californian Lemon; middle notes are Orris and Patchouli; base notes are Immortelle, Musk and Sand.",2016.0,"Juniper Berries, Californian Lemon","Orris, Patchouli","Immortelle, Musk, Sand","aromatic, woody, citrus, warm spicy",,https://fimgs.net/mdimg/perfume-thumbs/375x500.38819.jpg,for women and men,,,2026-06-06 23:52:57,Fragrantica,
https://www.fragrantica.com/perfume/Byredo/Bal-d-Afrique-Absolu-108421.html,Bal d'Afrique Absolu Byredofor women and men,Byredo,4.48,1616.0,"Bal d'Afrique AbsolubyByredois a Floral Woody Musk fragrance for women and men. This is a new fragrance.Bal d'Afrique Absoluwas launched in 2025. The nose behind this fragrance is Jerome Epinette. Top notes are Blackcurrant, Bergamot and Lemon; middle notes are Praline, Musk and Violet; base notes are Black Amber, Cedarwood and Vetiver.""Inspired by founder Ben Gorham's personal connection to Africa, particularly his father's experiences traveling and living there, Ben Gorham crafted Bal d’Afrique as both an imaginary journey and a celebration of Africa's rich cultural impact on dance, art, and music.Intensifying the gourmand aspect of Bal d’Afrique, this reimagined composition heightens the contrast between vibrant lightness and addictive depth, offering a richer, more addictive experience. Notes of bergamot, lemon, and blackcurrant offer a bold vibrance, melting into the sweetness of praline, musks, and violet, and finishing on a dramatic base of cedar, vetiver, and warm black amber.Beyond the fragrance, the homage to craftsmanship is reflected in the newly redesigned Absolu de Parfum bottle. The textured cap, inspired by Yakisugi, the Japanese art of charring wood, embodies the deep intensity, transformation, and enduring strength that mirrors the essence of the Absolu. The silver and gold atomizer spray, with its industrial edge, complements the bottle’s elemental design and the clean curves of the glass. Within the bottle, the hue of the Absolu de Parfum is intensified, offering a visual hint at the rich concentration of fragrance inside.""",2025.0,"Blackcurrant, Bergamot, Lemon","Praline, Musk, Violet","Black Amber, Cedarwood, Vetiver","citrus, woody, aromatic, sweet",Jerome Epinette,https://fimgs.net/mdimg/perfume-thumbs/375x500.108421.jpg,for women and men,,,2026-06-06 23:53:06,Fragrantica,
https://www.fragrantica.com/perfume/Byredo/Black-Saffron-Absolu-121649.html,Black Saffron Absolu Byredofor women and men,Byredo,4.12,88.0,"Black Saffron AbsolubyByredois a Oriental Spicy fragrance for women and men. This is a new fragrance.Black Saffron Absoluwas launched in 2025. Top notes are Saffron, Pomelo and Juniper Berries; middle notes are Leather, Black Violet and Rose; base notes are Blonde Woods, Raspberry and Vetiver.Black Saffron Absolu by Byredo is described as a more concentrated interpretation of the original Black Saffron composition. The fragrance opens with juniper berries and bright pomelo, coloured by a pronounced saffron note that gives the top an aromatic, spicy character. The heart combines black violet and Cristal Rose with a leather accord, introducing a floral-leathery facet that leads into a warm, woody base. Blonde woods, vetiver and a touch of raspberry round out the drydown, creating a unisex scent that moves from citrus and spice to floral leather and soft woods in an intensified absolu de parfum concentration.",2025.0,"Saffron, Pomelo, Juniper Berries","Leather, Black Violet, Rose","Blonde Woods, Raspberry, Vetiver","leather, warm spicy, animalic, rose",,https://fimgs.net/mdimg/perfume-thumbs/375x500.121649.jpg,for women and men,,,2026-06-06 23:53:16,Fragrantica,
https://www.fragrantica.com/perfume/Byredo/Blanche-Absolu-103743.html,Blanche Absolu Byredofor women and men,Byredo,4.07,528.0,"Blanche AbsolubyByredois a Floral Aldehyde fragrance for women and men. This is a new fragrance.Blanche Absoluwas launched in 2025. Top notes are Aldehydes, Black Pepper and Neroli; middle notes are Jasmine, Violet and Rose; base notes are Musk, Ambroxan, Cashmeran and Cashmere Wood.",2025.0,"Aldehydes, Black Pepper, Neroli","Jasmine, Violet, Rose","Musk, Ambroxan, Cashmeran, Cashmere Wood","musky, aldehydic, amber, powdery",,https://fimgs.net/mdimg/perfume-thumbs/375x500.103743.jpg,for women and men,,,2026-06-06 23:53:27,Fragrantica,
https://www.fragrantica.com/perfume/Byredo/Gypsy-Water-Absolu-121784.html,Gypsy Water Absolu Byredofor women and men,Byredo,3.44,219.0,"Gypsy Water AbsolubyByredois a Oriental Woody fragrance for women and men. This is a new fragrance.Gypsy Water Absoluwas launched in 2026. The nose behind this fragrance is Jérôme Epinette. Top notes are Pine needles, Black Pepper and Bergamot; middle notes are Incense, Orris and Carrot Seeds; base notes are Vanilla Absolute, White Suede and Ambroxan.Gypsy Water Absolu Byredo is a woody fragrance with pronounced spicy nuances, presented as a more concentrated interpretation of the original Gypsy Water theme. The composition opens with a contrast of sparkling bergamot, black pepper and aromatic pine needles. In the heart, creamy orris butter is combined with carrot seed to create an earthy warmth, nuanced by the smoky character of incense absolute. The base rests on ambroxan, vanilla absolute and white suede, forming a soft amber-woody trail that emphasizes both texture and depth.",2026.0,"Pine needles, Black Pepper, Bergamot","Incense, Orris, Carrot Seeds","Vanilla Absolute, White Suede, Ambroxan","amber, woody, powdery, smoky",Jérôme Epinette,https://fimgs.net/mdimg/perfume-thumbs/375x500.121784.jpg,for women and men,,,2026-06-06 23:53:38,Fragrantica,
https://www.fragrantica.com/perfume/Byredo/Mojave-Ghost-Absolu-97879.html,Mojave Ghost Absolu Byredofor women and men,Byredo,4.3,1095.0,"Mojave Ghost AbsolubyByredois a Floral Woody Musk fragrance for women and men. This is a new fragrance.Mojave Ghost Absoluwas launched in 2024. Top notes are Sapodilla and Ambrette; middle notes are Magnolia, Violet and Sandalwood; base notes are Musk, Amber and Cedarwood.Sandalwood, familiar ingredients are extracted in a higher concentration to create a longer-lasting scent with profound depths.The celebration of artisanship is visualised through a new perfume bottle which features a striking textural cap, inspired by traditional woodwork. Opening to reveal an atomizer spray engineered with more industrial leanings, considered juxtapositions craft a study in contrasts – a rarefied reinterpretation that stays true to the original signature.",2024.0,"Sapodilla, Ambrette","Magnolia, Violet, Sandalwood","Musk, Amber, Cedarwood","floral, musky, powdery, woody",,https://fimgs.net/mdimg/perfume-thumbs/375x500.97879.jpg,for women and men,,,2026-06-06 23:53:49,Fragrantica,
https://www.fragrantica.com/perfume/Byredo/Rose-of-No-Man-s-Land-Absolu-108422.html,Rose of No Man's Land Absolu Byredofor women and men,Byredo,4.25,320.0,"Rose of No Man's Land AbsolubyByredois a Oriental Floral fragrance for women and men. This is a new fragrance.Rose of No Man's Land Absoluwas launched in 2025. Top notes are Saffron, Blackcurrant and Pink Pepper; middle notes are Raspberry and Peony; base notes are Patchouli, Black Amber and Papyrus.""Rose of No Man's Land Absolu reimagines the iconic scent with a more opulent, smoky intensity, paying tribute to the rose that flourishes where others fear to venture. At the heart of the composition beats a trilogy of exquisite roses, seamlessly weaving themselves through the top and base notes to add an elegant depth. Top notes of saffron and blackcurrant introduce a fruity touch with a punch of pink pepper, with black raspberry and peony intertwining themselves with the roses. A base of papyrus, dark patchouli and warm amber allows the fragrance to linger with smoky intensity.The Absolu de Parfum is held in a redesigned bottle, an homage to craftsmanship. Embodying the deep intensity and transformation, the textured cap, inspired by Yakisugi, the Japanese art of charring wood, opens to reveal the silver and gold atomizer spray, complementing the bottle’s elemental design and the clean curves of the glass that shows the intense color of the fragrance within.""",2025.0,"Saffron, Blackcurrant, Pink Pepper","Raspberry, Peony","Patchouli, Black Amber, Papyrus","fruity, floral, warm spicy, woody",,https://fimgs.net/mdimg/perfume-thumbs/375x500.108422.jpg,for women and men,,,2026-06-06 23:53:59,Fragrantica,
https://www.fragrantica.com/perfume/Louis-Vuitton/Ink-Mark-115407.html,Ink Mark Louis Vuittonfor women and men,Louis Vuitton,4.33,241.0,"Ink MarkbyLouis Vuittonis a Oriental Woody fragrance for women and men. This is a new fragrance.Ink Markwas launched in 2025. The nose behind this fragrance is Jacques Cavallier Belletrud. The fragrance features Sandalwood, Amber and Incense.Ink Mark by Louis Vuitton is a unisex fragrance introduced for 2025 as part of the Journey to China collection. The scent comes in the house’s signature flacon rendered in a milk white lacquer with a plum-colored cap. Official note details and concentration have not been disclosed; the collection is planned to launch on October 17, 2025.",2025.0,,,,"woody, powdery, warm spicy, aromatic",Jacques Cavallier Belletrud,https://fimgs.net/mdimg/perfume-thumbs/375x500.115407.jpg,for women and men,,,2026-06-09 09:54:25,Fragrantica,"Sandalwood, Amber, Incense"
https://www.fragrantica.com/perfume/Louis-Vuitton/Moon-Tale-115408.html,Moon Tale Louis Vuittonfor women and men,Louis Vuitton,4.5,254.0,"Moon TalebyLouis Vuittonis a fragrance for women and men. This is a new fragrance.Moon Talewas launched in 2025. The nose behind this fragrance is Jacques Cavallier Belletrud. The fragrance features Peony, Raspberry, Jasmine Sambac, Magnolia and Rose Geranium.Moon Tale by Louis Vuitton is a unisex fragrance announced as part of the Journey to China collection. It is presented in the house’s signature bottle, finished in cyan blue lacquer with a bright orange cap. Official note details and concentration have not been disclosed; the collection is planned to launch on October 17, 2025.",2025.0,,,,"floral, fruity, white floral, fresh",Jacques Cavallier Belletrud,https://fimgs.net/mdimg/perfume-thumbs/375x500.115408.jpg,for women and men,,,2026-06-09 09:54:37,Fragrantica,"Peony, Raspberry, Jasmine Sambac, Magnolia, Rose Geranium"
https://www.fragrantica.com/perfume/Louis-Vuitton/Rain-Tea-115406.html,Rain Tea Louis Vuittonfor women and men,Louis Vuitton,4.43,316.0,"Rain TeabyLouis Vuittonis a fragrance for women and men. This is a new fragrance.Rain Teawas launched in 2025. The nose behind this fragrance is Jacques Cavallier Belletrud. The fragrance features Tea, Lemongrass, Rose, Magnolia and Woody Notes.Rain Tea by Louis Vuitton is a unisex fragrance announced as part of the Journey to China collection. It is presented in a pastel mint green lacquered bottle with a salmon pink cap. Official note details and concentration have not been disclosed; the collection is planned to launch on October 17, 2025.",2025.0,,,,"citrus, fresh spicy, green, fresh",Jacques Cavallier Belletrud,https://fimgs.net/mdimg/perfume-thumbs/375x500.115406.jpg,for women and men,,,2026-06-09 09:54:46,Fragrantica,"Tea, Lemongrass, Rose, Magnolia, Woody Notes"
https://www.fragrantica.com/perfume/Louis-Vuitton/Cosmic-Cloud-68355.html,Cosmic Cloud Louis Vuittonfor women and men,Louis Vuitton,3.7,338.0,"Cosmic CloudbyLouis Vuittonis a Chypre Fruity fragrance for women and men.Cosmic Cloudwas launched in 2021. The nose behind this fragrance is Jacques Cavallier Belletrud. The fragrance features Musk, Black Currant, Bergamot and Patchouli.",2021.0,,,,"musky, powdery, fruity, animalic",Jacques Cavallier Belletrud,https://fimgs.net/mdimg/perfume-thumbs/375x500.68355.jpg,for women and men,,,2026-06-09 09:54:57,Fragrantica,"Musk, Black Currant, Bergamot, Patchouli"
https://www.fragrantica.com/perfume/Louis-Vuitton/Dancing-Blossom-68358.html,Dancing Blossom Louis Vuittonfor women and men,Louis Vuitton,4.03,284.0,"Dancing BlossombyLouis Vuittonis a Floral fragrance for women and men.Dancing Blossomwas launched in 2021. The nose behind this fragrance is Jacques Cavallier Belletrud. The fragrance features May Rose, Jasmine Sambac, Tuberose and Osmanthus.",2021.0,,,,"white floral, rose, floral, tuberose",Jacques Cavallier Belletrud,https://fimgs.net/mdimg/perfume-thumbs/375x500.68358.jpg,for women and men,,,2026-06-09 09:55:05,Fragrantica,"May Rose, Jasmine Sambac, Tuberose, Osmanthus"
https://www.fragrantica.com/perfume/Louis-Vuitton/Fantasmagory-116625.html,Fantasmagory Louis Vuittonfor women and men,Louis Vuitton,4.2,470.0,"FantasmagorybyLouis Vuittonis a Oriental Vanilla fragrance for women and men. This is a new fragrance.Fantasmagorywas launched in 2025. The nose behind this fragrance is Jacques Cavallier Belletrud. Top notes are Anise and Ginger; middle notes are Almond and Floral Notes; base notes are Vanilla and Leather.Fantasmagory by Louis Vuitton is a unisex Eau de Parfum released in 2025 as part of the brand’s Les Extraits Collection. Created by Jacques Cavallier Belletrud, the composition focuses on vanilla, opening with ginger and moving through a soft gourmand heart of almond reminding of amaretto and diffuse floral nuances, settling into a base of vanilla with a subtle leather facet. The fragrance is presented in a sculptural bottle by architect Frank Gehry, with clear glass and a polished metal cap.",2025.0,"Anise, Ginger","Almond, Floral Notes","Vanilla, Leather","vanilla, almond, nutty, sweet",Jacques Cavallier Belletrud,https://fimgs.net/mdimg/perfume-thumbs/375x500.116625.jpg,for women and men,,,2026-06-09 09:55:14,Fragrantica,
https://www.fragrantica.com/perfume/Louis-Vuitton/Myriad-85363.html,Myriad Louis Vuittonfor women and men,Louis Vuitton,3.84,660.0,"MyriadbyLouis Vuittonis a Oriental Woody fragrance for women and men.Myriadwas launched in 2023. The nose behind this fragrance is Jacques Cavallier Belletrud. Top note is Saffron; middle notes are Bulgarian Rose and Grasse Rose; base notes are Assam Oud, Ambrette, Cacao and White Musk.",2023.0,Saffron,"Bulgarian Rose, Grasse Rose","Assam Oud, Ambrette, Cacao, White Musk","oud, rose, warm spicy, metallic",Jacques Cavallier Belletrud,https://fimgs.net/mdimg/perfume-thumbs/375x500.85363.jpg,for women and men,,,2026-06-09 09:55:24,Fragrantica,
https://www.fragrantica.com/perfume/Louis-Vuitton/Rhapsody-68359.html,Rhapsody Louis Vuittonfor women and men,Louis Vuitton,4.05,450.0,"RhapsodybyLouis Vuittonis a Chypre Floral fragrance for women and men.Rhapsodywas launched in 2021. The nose behind this fragrance is Jacques Cavallier Belletrud. The fragrance features Oakmoss, Mate, Lily-of-the-Valley, Jasmine, Rose, Patchouli and Vetiver.",2021.0,,,,"mossy, earthy, aromatic, fresh spicy",Jacques Cavallier Belletrud,https://fimgs.net/mdimg/perfume-thumbs/375x500.68359.jpg,for women and men,,,2026-06-09 09:55:34,Fragrantica,"Oakmoss, Mate, Lily-of-the-Valley, Jasmine, Rose, Patchouli, Vetiver"
https://www.fragrantica.com/perfume/Louis-Vuitton/Stellar-Times-68356.html,Stellar Times Louis Vuittonfor women and men,Louis Vuitton,4.42,1096.0,"Stellar TimesbyLouis Vuittonis a Oriental Floral fragrance for women and men.Stellar Timeswas launched in 2021. The nose behind this fragrance is Jacques Cavallier Belletrud. The fragrance features Orange Blossom, Amber and Woody Notes.",2021.0,,,,"white floral, amber, woody, citrus",Jacques Cavallier Belletrud,https://fimgs.net/mdimg/perfume-thumbs/375x500.68356.jpg,for women and men,,,2026-06-09 09:55:43,Fragrantica,"Orange Blossom, Amber, Woody Notes"
https://www.fragrantica.com/perfume/Louis-Vuitton/Symphony-68357.html,Symphony Louis Vuittonfor women and men,Louis Vuitton,4.48,2600.0,"SymphonybyLouis Vuittonis a Citrus fragrance for women and men.Symphonywas launched in 2021. The nose behind this fragrance is Jacques Cavallier Belletrud. The fragrance features Grapefruit, Bergamot and Ginger.",2021.0,,,,"citrus, fresh spicy, aromatic, floral",Jacques Cavallier Belletrud,https://fimgs.net/mdimg/perfume-thumbs/375x500.68357.jpg,for women and men,,,2026-06-09 09:55:50,Fragrantica,"Grapefruit, Bergamot, Ginger"
https://www.fragrantica.com/perfume/Louis-Vuitton/Afternoon-Swim-53947.html,Afternoon Swim  Louis Vuittonfor women and men,Louis Vuitton,4.42,4763.0,"Afternoon SwimbyLouis Vuittonis a Citrus fragrance for women and men.Afternoon Swimwas launched in 2019. The nose behind this fragrance is Jacques Cavallier Belletrud. The fragrance features Mandarin Orange, Sicilian Orange, Bergamot, Ambergris and Ginger.Les Colognes Louis Vuitton is the new line of the Les Parfums Louis Vuitton collection that comes out in April 2019. Perfumer Jacques Cavallier Belletrud signed all creations of this house. The three fresh, cologne-like scents (in EDP concentration) are named Sun Song, Cactus Garden and Afternoon Swim.Louis Vuitton collaborated with L.A.-based artist Alex Israel, who designed the outer packaging of the new fragrances. The flacons and boxes come in a bright yellow, green and blue, with drawings of a sun, a cactus and a wave.Afternoon Swim is a ""full of energy"" scent, with orange, bergamot and mandarin. ""I wanted a shot of vitamin C in the fragrance, something full of energy,"" explained Cavallier Belletrud.The fragrances will be available as a 100 and 200 ml Eau de Parfum.",2019.0,,,,"citrus, fresh spicy, sweet, amber",Jacques Cavallier Belletrud,https://fimgs.net/mdimg/perfume-thumbs/375x500.53947.jpg,for women and men,,,2026-06-09 09:56:00,Fragrantica,"Mandarin Orange, Sicilian Orange, Bergamot, Ambergris, Ginger"
https://www.fragrantica.com/perfume/Louis-Vuitton/Ambre-Levant-122775.html,Ambre Levant Louis Vuittonfor women and men,Louis Vuitton,4.28,533.0,"Ambre LevantbyLouis Vuittonis a Oriental Woody fragrance for women and men. This is a new fragrance.Ambre Levantwas launched in 2026. The nose behind this fragrance is Jacques Cavallier Belletrud. Top notes are Cinnamon and Mandarin; middle notes are Incense and White Pepper; base notes are Amber, Ambergris, Oud and Labdanum.There is a moment when the world takes on a profound intensity—when the sun begins its descent and the sky turns to amber just before surrendering to the night. In this captivating golden hour, the sky still holds the warmth of the day, while its memory lingers gently in the air.From one horizon to the other, this luminous glow envelops the landscape, softening boundaries and erasing distance. It carries a unique power of attraction. Gradually, the world seems transformed by a new energy, as the first stirrings of evening begin to unfold. Everything quickens and intensifies, as if moved by a single, shared impulse.Ambre Levant is born from this fleeting instant, when amber light rises and unites sky and earth in a seamless wash of color. At its heart lies “black gold,” an emblematic treasure of Middle Eastern perfumery, which deepens the composition and amplifies its intensity tenfold. For Jacques Cavallier Belletrud, it is among the most sensual of woods—unique and of exceptional quality. Its refined woody character reveals a subtle animality, balanced by an elegance that is both spicy and warmly ambered.With its absolute amber signature, Ambre Levant captures the light of the golden hour and extends its radiance onto the skin.The iconic Louis Vuitton flacon, crafted in transparent black glass, is reimagined here in a deep, warm amber hue. It appears to glow from within, as though infused with the very light of sunset. This 100 ml Eau de Parfum bottle is also designed to be refilled at select stores equipped with a perfume fountain.",2026.0,"Cinnamon, Mandarin","Incense, White Pepper","Amber, Ambergris, Oud, Labdanum","amber, oud, balsamic, animalic",Jacques Cavallier Belletrud,https://fimgs.net/mdimg/perfume-thumbs/375x500.122775.jpg,for women and men,,,2026-06-09 09:56:10,Fragrantica,
